{"aggregateHash":"ab37afddb03de68dfdd2f197942eedbf837a828d58236018bf2ba17f0f22667a","normalizationProfileHash":"b7572ef7309692163b666c290b5995d6656af473736290be7b24e7463d435fc6","schemaVersion":"normalization-map.v1","segments":[{"canonicalEndByte":20,"canonicalStartByte":0,"segmentOrdinal":0,"transform":{"kind":"identity","sourcePositions":[{"decodedScalarEnd":20,"decodedScalarStart":0,"endColumn":10,"endLine":2,"kind":"text_position","opaqueSourceUnitId":"43fa36e9cbb26592aca68cfce1ad5def402ef36ac53c0146f622a1b1d218c70d","positionOrdinal":0,"rawByteEnd":20,"rawByteStart":0,"startColumn":0,"startLine":0}]}}],"sourceUnits":[{"displayMetadataPayloadRef":"8e91a015d7693a00fa3d75e7776836b02967d4113cc125542de1cc9540512d39","kind":"raw_file","opaqueSourceUnitId":"43fa36e9cbb26592aca68cfce1ad5def402ef36ac53c0146f622a1b1d218c70d","sourceBytes":20,"sourceSha256":"3a413cf18e813c868e5859350b4a6e02fe271e2bf4224b92eb14cf3829cb9a9e","sourceUnitOrdinal":0}],"textBufferBytes":20,"textBufferSha256":"3a413cf18e813c868e5859350b4a6e02fe271e2bf4224b92eb14cf3829cb9a9e"}