{"aggregateHash":"04fc956ebfb464df5d1723a19bf1ec96f4a076a7589ccb0e442030cf0f72c6bb","normalizationProfileHash":"0000000000000000000000000000000000000000000000000000000000000000","schemaVersion":"normalization-map.v1","segments":[{"canonicalEndByte":1,"canonicalStartByte":0,"segmentOrdinal":0,"transform":{"kind":"identity","sourcePositions":[{"decodedScalarEnd":1,"decodedScalarStart":0,"endColumn":1,"endLine":0,"kind":"text_position","opaqueSourceUnitId":"0000000000000000000000000000000000000000000000000000000000000000","positionOrdinal":0,"rawByteEnd":1,"rawByteStart":0,"startColumn":0,"startLine":0}]}}],"sourceUnits":[{"displayMetadataPayloadRef":"0000000000000000000000000000000000000000000000000000000000000000","kind":"raw_file","opaqueSourceUnitId":"0000000000000000000000000000000000000000000000000000000000000000","sourceBytes":1,"sourceSha256":"0000000000000000000000000000000000000000000000000000000000000000","sourceUnitOrdinal":0}],"textBufferBytes":1,"textBufferSha256":"0000000000000000000000000000000000000000000000000000000000000000"}